{
  "format": "bolt.approval_key_registry.v0.1",
  "registry_id": "approval-keys-demo",
  "issued_at": "2026-07-02T00:00:00Z",
  "keys": [
    {
      "public_key_ref": "human-operator-demo-key-00",
      "algorithm": "ed25519",
      "public_key": "ed25519:fa4834147f6e690c3693eff61336046403cd8ae2a14f31b3c407358569239565",
      "state": "revoked",
      "not_before": "2026-01-01T00:00:00Z",
      "expires_at": "2099-12-31T00:00:00Z",
      "rotated_to": "human-operator-demo-key-01",
      "revoked_at": "2026-07-02T00:00:00Z",
      "revocation_reason": "rotation-compromised-demo"
    },
    {
      "public_key_ref": "human-operator-demo-key-01",
      "algorithm": "ed25519",
      "public_key": "ed25519:197f6b23e16c8532c6abc838facd5ea789be0c76b2920334039bfa8b3d368d61",
      "state": "active",
      "not_before": "2026-01-01T00:00:00Z",
      "expires_at": "2099-12-31T00:00:00Z",
      "rotated_from": "human-operator-demo-key-00",
      "rotated_to": "human-operator-demo-key-02"
    },
    {
      "public_key_ref": "human-operator-demo-key-02",
      "algorithm": "ed25519",
      "public_key": "ed25519:4508a07aa941707f3eb2db94c8897a80b2c1197476b6de213ac273df7d86c4ff",
      "state": "active",
      "not_before": "2026-07-01T00:00:00Z",
      "expires_at": "2027-12-31T00:00:00Z",
      "rotated_from": "human-operator-demo-key-01"
    }
  ]
}
